{
  "schema": "vitte.diagnostic",
  "schema_version": "1.0.0",
  "code": "LEX0002",
  "severity": "error",
  "phase": "lexer",
  "message_key": "LEX_E_INVALID_CHAR",
  "message": "lf source diagnostic",
  "primary_span": {
    "file": "lf.vit",
    "start": { "line": 2, "column": 3, "byte": 22 },
    "end": { "line": 2, "column": 7, "byte": 26 }
  },
  "labels": [
    {
      "kind": "primary",
      "message": "lf line ending is handled",
      "span": {
        "file": "lf.vit",
        "start": { "line": 2, "column": 3, "byte": 22 },
        "end": { "line": 2, "column": 7, "byte": 26 }
      }
    }
  ],
  "notes": ["lf diagnostic source case"],
  "helps": ["lf line endings must keep stable line numbers"],
  "suggestions": []
}
