{
  "schema": "vitte.diagnostic",
  "schema_version": "1.0.0",
  "code": "LEX0002",
  "severity": "error",
  "phase": "lexer",
  "message_key": "LEX_E_INVALID_CHAR",
  "message": "unicode source diagnostic",
  "primary_span": {
    "file": "unicode.vit",
    "start": { "line": 1, "column": 25, "byte": 25 },
    "end": { "line": 1, "column": 26, "byte": 27 }
  },
  "labels": [
    {
      "kind": "primary",
      "message": "unicode identifier is highlighted",
      "span": {
        "file": "unicode.vit",
        "start": { "line": 1, "column": 25, "byte": 25 },
        "end": { "line": 1, "column": 26, "byte": 27 }
      }
    }
  ],
  "notes": ["unicode diagnostic source case"],
  "helps": ["render Unicode text without corrupting UTF-8"],
  "suggestions": []
}
