{
  "schema": "vitte.diagnostic",
  "schema_version": "1.0.0",
  "code": "LEX0002",
  "severity": "error",
  "phase": "lexer",
  "message_key": "LEX_E_INVALID_CHAR",
  "message": "accented source diagnostic",
  "primary_span": {
    "file": "accents.vit",
    "start": { "line": 1, "column": 6, "byte": 5 },
    "end": { "line": 1, "column": 10, "byte": 10 }
  },
  "labels": [
    {
      "kind": "primary",
      "message": "accented identifier is highlighted",
      "span": {
        "file": "accents.vit",
        "start": { "line": 1, "column": 6, "byte": 5 },
        "end": { "line": 1, "column": 10, "byte": 10 }
      }
    }
  ],
  "notes": ["accented diagnostic source case"],
  "helps": ["keep the displayed column separate from UTF-8 byte offsets"],
  "suggestions": []
}
