{
  "schema": "vitte.diagnostic",
  "schema_version": "1.0.0",
  "code": "LEX0002",
  "severity": "error",
  "phase": "lexer",
  "message_key": "LEX_E_INVALID_CHAR",
  "message": "tabbed source diagnostic",
  "primary_span": {
    "file": "tabs.vit",
    "start": { "line": 2, "column": 2, "byte": 22 },
    "end": { "line": 2, "column": 6, "byte": 26 }
  },
  "labels": [
    {
      "kind": "primary",
      "message": "tabbed line is highlighted",
      "span": {
        "file": "tabs.vit",
        "start": { "line": 2, "column": 2, "byte": 22 },
        "end": { "line": 2, "column": 6, "byte": 26 }
      }
    }
  ],
  "notes": ["tab diagnostic source case"],
  "helps": ["tabs must not break stable rendering"],
  "suggestions": []
}
