{
  "schema": "vitte.diagnostic",
  "schema_version": "1.0.0",
  "code": "PARSE_E_UNCLOSED_BLOCK",
  "severity": "error",
  "phase": "parser",
  "message_key": "PARSE_E_UNCLOSED_BLOCK",
  "message": "unclosed block",
  "primary_span": {
    "file": "multiline.vit",
    "start": { "line": 2, "column": 12, "byte": 24 },
    "end": { "line": 5, "column": 2, "byte": 71 }
  },
  "labels": [
    {
      "kind": "primary",
      "message": "block starts here and reaches end of input",
      "span": {
        "file": "multiline.vit",
        "start": { "line": 2, "column": 12, "byte": 24 },
        "end": { "line": 5, "column": 2, "byte": 71 }
      }
    }
  ],
  "notes": ["the opening brace on line 2 has no matching closing brace before end of input"],
  "helps": ["add the missing closing brace"],
  "suggestions": []
}
