{
  "schema": "vitte.diagnostic",
  "schema_version": "1.0.0",
  "code": "TYPECK_E_ASSIGN_MISMATCH",
  "severity": "error",
  "phase": "typeck",
  "message_key": "TYPECK_E_ASSIGN_MISMATCH",
  "message": "assignment type mismatch",
  "primary_span": {
    "file": "types.vit",
    "start": { "line": 4, "column": 9, "byte": 51 },
    "end": { "line": 4, "column": 15, "byte": 57 }
  },
  "labels": [
    {
      "kind": "primary",
      "message": "found string",
      "span": {
        "file": "types.vit",
        "start": { "line": 4, "column": 9, "byte": 51 },
        "end": { "line": 4, "column": 15, "byte": 57 }
      }
    },
    {
      "kind": "secondary",
      "message": "variable declared as int here",
      "span": {
        "file": "types.vit",
        "start": { "line": 2, "column": 5, "byte": 17 },
        "end": { "line": 2, "column": 10, "byte": 22 }
      }
    }
  ],
  "notes": ["assignments must preserve the declared type"],
  "helps": [],
  "suggestions": []
}
