{
  "schema": "vitte.diagnostic",
  "schema_version": "1.0.0",
  "code": "LEX0002",
  "severity": "error",
  "phase": "lexer",
  "message_key": "LEX_E_INVALID_CHAR",
  "message": "empty source file diagnostic",
  "primary_span": {
    "file": "empty.vit",
    "start": { "line": 1, "column": 1, "byte": 0 },
    "end": { "line": 1, "column": 2, "byte": 1 }
  },
  "labels": [
    {
      "kind": "primary",
      "message": "empty source has no line to print",
      "span": {
        "file": "empty.vit",
        "start": { "line": 1, "column": 1, "byte": 0 },
        "end": { "line": 1, "column": 2, "byte": 1 }
      }
    }
  ],
  "notes": ["empty file diagnostic source case"],
  "helps": ["render location even when the source line is absent"],
  "suggestions": []
}
