{
  "schema": "vitte.diagnostic",
  "schema_version": "1.0.0",
  "code": "LEX0002",
  "severity": "error",
  "phase": "lexer",
  "message_key": "LEX_E_INVALID_CHAR",
  "message": "long source line diagnostic",
  "primary_span": {
    "file": "long-line.vit",
    "start": { "line": 1, "column": 24, "byte": 23 },
    "end": { "line": 1, "column": 78, "byte": 77 }
  },
  "labels": [
    {
      "kind": "primary",
      "message": "long identifier is highlighted",
      "span": {
        "file": "long-line.vit",
        "start": { "line": 1, "column": 24, "byte": 23 },
        "end": { "line": 1, "column": 78, "byte": 77 }
      }
    }
  ],
  "notes": ["long line diagnostic source case"],
  "helps": ["long lines must render deterministically"],
  "suggestions": []
}
