{
  "schema": "vitte.diagnostic",
  "schema_version": "1.0.0",
  "code": "PAR0035",
  "severity": "error",
  "phase": "parser",
  "message_key": "PARSE_E_TOPLEVEL_DECL_EXPECTED",
  "message": "top-level declaration expected",
  "primary_span": {
    "file": "hello.vit",
    "start": { "line": 1, "column": 1, "byte": 0 },
    "end": { "line": 1, "column": 4, "byte": 3 }
  },
  "labels": [
    {
      "kind": "primary",
      "message": "expected `proc`, `const`, `form`, `pick`, or another declaration keyword",
      "span": {
        "file": "hello.vit",
        "start": { "line": 1, "column": 1, "byte": 0 },
        "end": { "line": 1, "column": 4, "byte": 3 }
      }
    }
  ],
  "notes": ["the parser is at module scope, not inside a declaration body"],
  "helps": ["start declarations with a valid top-level keyword"],
  "suggestions": [
    {
      "message": "replace `pro` with `proc`",
      "replacement": "proc",
      "span": {
        "file": "hello.vit",
        "start": { "line": 1, "column": 1, "byte": 0 },
        "end": { "line": 1, "column": 4, "byte": 3 }
      },
      "applicability": "machine-applicable"
    }
  ]
}
