{
  "schema": "vitte.diagnostic",
  "schema_version": "1.0.0",
  "code": "LEX0002",
  "severity": "error",
  "phase": "lexer",
  "message_key": "LEX_E_INVALID_CHAR",
  "message": "ascii source diagnostic",
  "primary_span": {
    "file": "ascii.vit",
    "start": { "line": 1, "column": 1, "byte": 0 },
    "end": { "line": 1, "column": 5, "byte": 4 }
  },
  "labels": [
    {
      "kind": "primary",
      "message": "ascii keyword is highlighted",
      "span": {
        "file": "ascii.vit",
        "start": { "line": 1, "column": 1, "byte": 0 },
        "end": { "line": 1, "column": 5, "byte": 4 }
      }
    }
  ],
  "notes": ["ascii diagnostic source case"],
  "helps": ["keep ASCII spans one-based"],
  "suggestions": []
}
